[
  {
    "client_id": "gtcx_os",
    "name": "GTCX OS",
    "segment": "internal_gtcx_product",
    "stage": "pilot",
    "geographies": ["Africa", "Global South"],
    "sectors": ["commodity_trade", "trust_infrastructure", "protocols"],
    "goals": {
      "capital": "Strategic capital for core trust and commodity trade infrastructure",
      "revenue": "Protocol licensing, sovereign pilots, enterprise integrations",
      "partnerships": "Sovereigns, DFIs, banks, trade bodies, commodity institutions",
      "visibility": "Establish GTCX as trust infrastructure for African commodity markets",
      "investor_relations": "Maintain infrastructure-scale capital narrative"
    },
    "primary_products": [
      {
        "name": "GTCX Protocol Rail",
        "description": "Core protocol infrastructure for verifiable commodity trade compliance",
        "target_buyers": ["governments", "commodity_exchanges", "banks", "trade_bodies"],
        "proof_points": ["multi-repo platform architecture", "protocol governance", "product portfolio integration"]
      }
    ],
    "positioning": {
      "one_liner": "Trust infrastructure for verifiable African commodity trade.",
      "narrative": "GTCX provides the protocol layer for trusted, compliant, and financeable commodity markets across Africa and the Global South.",
      "differentiators": ["protocol-first", "Africa-scale", "multi-product ecosystem"]
    },
    "proof_points": ["gtcx-os platform monorepo", "ecosystem product portfolio"],
    "constraints": ["strategic claims require evidence", "sovereign outreach requires founder approval"],
    "systems": {}
  },
  {
    "client_id": "terra_os",
    "name": "TerraOS",
    "segment": "internal_gtcx_product",
    "stage": "pilot",
    "geographies": ["Africa", "Global South"],
    "sectors": ["land", "govtech", "property_rights", "financial_inclusion"],
    "goals": {
      "capital": "DFI, foundation, and catalytic capital for land infrastructure pilots",
      "revenue": "Government, bank, insurer, and development agency pilots",
      "partnerships": "Land agencies, banks, insurers, traditional leaders, DFIs",
      "visibility": "Position TerraOS as land economic infrastructure",
      "investor_relations": "Build infrastructure and DPG-aligned capital pipeline"
    },
    "primary_products": [
      {
        "name": "Land Economic Operating System",
        "description": "Administrative, ambient, and economic intelligence layers for land registration and financeability",
        "target_buyers": ["land_agencies", "banks", "insurers", "dfis", "development_agencies"],
        "proof_points": ["pilot-ready dashboard", "PostGIS architecture", "offline verification"]
      }
    ],
    "positioning": {
      "one_liner": "The land economic operating system for emerging markets.",
      "narrative": "TerraOS turns land records and signals into verifiable, financeable economic infrastructure.",
      "differentiators": ["land credit score", "ambient registration", "offline verification"]
    },
    "proof_points": ["backend dev-complete", "pilot-ready frontend", "DRC/Zimbabwe demo data"],
    "constraints": ["government outreach requires approval", "land-rights claims require source review"],
    "systems": {}
  },
  {
    "client_id": "markets_os",
    "name": "Markets OS",
    "segment": "internal_gtcx_product",
    "stage": "pilot",
    "geographies": ["Africa"],
    "sectors": ["natural_resources", "commodity_markets", "dealer_broker"],
    "goals": {
      "capital": "Strategic capital for regulated-market readiness",
      "revenue": "Buyer, refiner, trader, broker, and institutional pilot pipeline",
      "partnerships": "Commodity buyers, brokers, exchanges, banks, custody providers",
      "visibility": "Position as dealer-broker infrastructure for African natural resources",
      "investor_relations": "Track market-infrastructure investors and strategic partners"
    },
    "primary_products": [
      {
        "name": "AI-Native Dealer-Broker Infrastructure",
        "description": "Dealer-broker product surfaces and transaction kernel for African natural resources markets",
        "target_buyers": ["brokers", "traders", "refiners", "banks", "commodity_platforms"],
        "proof_points": ["EIX transaction kernel", "internal desk surface", "regulated-market readiness artifacts"]
      }
    ],
    "positioning": {
      "one_liner": "Dealer-broker infrastructure for African natural resources markets.",
      "narrative": "Markets OS helps structure trusted, compliant, and intelligence-led transactions across African commodity markets.",
      "differentiators": ["transaction kernel", "dealer-broker focus", "GTCX ecosystem integration"]
    },
    "proof_points": ["product spec", "EIX spec", "advisory surface"],
    "constraints": ["regulated-market claims require compliance review", "commercial terms require finance review"],
    "systems": {}
  },
  {
    "client_id": "compliance_os",
    "name": "ComplianceOS",
    "segment": "internal_gtcx_product",
    "stage": "growth",
    "geographies": ["Africa", "Global"],
    "sectors": ["compliance", "commodity_trade", "regtech"],
    "goals": {
      "capital": "Strategic enterprise/regtech capital",
      "revenue": "Enterprise compliance, buyer, auditor, and regulator relationships",
      "partnerships": "Standards bodies, auditors, buyers, regulators, supply-chain platforms",
      "visibility": "Own assess-once-comply-everywhere narrative",
      "investor_relations": "Maintain enterprise AI compliance narrative"
    },
    "primary_products": [
      {
        "name": "AI-Native Compliance Infrastructure",
        "description": "Cross-framework harmonization, evidence, scoring, credentials, and trust layer",
        "target_buyers": ["enterprises", "auditors", "regulators", "commodity_buyers"],
        "proof_points": ["Core12 ontology", "framework registry", "trust layer spec"]
      }
    ],
    "positioning": {
      "one_liner": "Assess once, comply everywhere.",
      "narrative": "ComplianceOS harmonizes frameworks and evidence so commodity supply-chain actors can prove compliance across multiple regimes.",
      "differentiators": ["Core12", "Trust Layer", "evidence reuse"]
    },
    "proof_points": ["50 deep frameworks", "175 registry frameworks", "trust layer runtime contract"],
    "constraints": ["framework depth claims must match evidence", "AI trust claims require proof"],
    "systems": {}
  },
  {
    "client_id": "exploration_os",
    "name": "ExplorationOS",
    "segment": "internal_gtcx_product",
    "stage": "pilot",
    "geographies": ["Africa"],
    "sectors": ["mining", "field_operations", "exploration"],
    "goals": {
      "capital": "Pilot and strategic mining-tech capital",
      "revenue": "Mining company and exploration team pilots",
      "partnerships": "Mining operators, satellite/data providers, geological agencies",
      "visibility": "Show controlled preproduction readiness for field operations",
      "investor_relations": "Build credible field-tech readiness narrative"
    },
    "primary_products": [
      {
        "name": "Offline-First Exploration Mobile App",
        "description": "Canonical mobile application for exploration field operations",
        "target_buyers": ["mining_companies", "exploration_teams", "geological_agencies"],
        "proof_points": ["mobile-v2 supported surface", "offline-write integrity checks", "pilot launch checklist"]
      }
    ],
    "positioning": {
      "one_liner": "Offline-first field operating system for exploration teams.",
      "narrative": "ExplorationOS supports controlled mobile field operations where connectivity, validation, and data integrity matter.",
      "differentiators": ["offline-first", "field validation", "pilot-ready runbooks"]
    },
    "proof_points": ["mobile-v2 canonical app", "pilot launch checklist"],
    "constraints": ["production readiness claims require current evidence"],
    "systems": {}
  },
  {
    "client_id": "terminal_os",
    "name": "FIFTY-FOUR / Terminal OS",
    "segment": "internal_gtcx_product",
    "stage": "pilot",
    "geographies": ["Africa"],
    "sectors": ["market_intelligence", "commodity_markets", "media"],
    "goals": {
      "capital": "Strategic media/data capital",
      "revenue": "Subscriptions, data products, sponsorships, executive memberships",
      "partnerships": "Media, data, trade, executive, and ecosystem partners",
      "visibility": "Become the intelligence surface for African commodity markets",
      "investor_relations": "Build data/media platform narrative"
    },
    "primary_products": [
      {
        "name": "FIFTY-FOUR Intelligence Platform",
        "description": "Frontend and documentation system for African commodity market intelligence surfaces",
        "target_buyers": ["executives", "investors", "trade_operators", "media_partners"],
        "proof_points": ["8 product surfaces", "Index54", "DealRoom54", "Executive54"]
      }
    ],
    "positioning": {
      "one_liner": "The intelligence platform for African commodity markets.",
      "narrative": "FIFTY-FOUR packages country, corridor, trade, deal, and executive intelligence into a product-grade market surface.",
      "differentiators": ["54-country frame", "multi-surface intelligence", "commodity-market focus"]
    },
    "proof_points": ["Next.js app", "8 top-level product surfaces"],
    "constraints": ["market intelligence claims require source provenance"],
    "systems": {}
  },
  {
    "client_id": "griot_ai",
    "name": "Griot AI",
    "segment": "internal_gtcx_product",
    "stage": "pilot",
    "geographies": ["Africa"],
    "sectors": ["intelligence_media", "content", "data"],
    "goals": {
      "capital": "Media/data product capital",
      "revenue": "Content, intelligence, API, sponsor, and distribution partnerships",
      "partnerships": "Media platforms, data providers, event organizers, ecosystem hubs",